song,singer,genre,album,userRating
Dheere Dheere Bol Koi Sun Na Le,"Lata Mangeshkar, Mukesh",Romantic,Gora Aur Kala,8.2/10
Mohenjo Daro,"A.R. Rahman, Arijit Singh, Bela Shende, Sanah Moidutty",Dance,Mohenjo Daro,9.0/10
Jai Jai Shiv Shankar,"Kishore Kumar, Lata Mangeshkar",Dance,Aap Ki Kasam,8.4/10
Ladki Kyon Na Jane Kyon,"Alka Yagnik, Shaan",Dance,Hum Tum,9.4/10
Drama Queen,"Shreya Ghoshal, Vishal Dadlani",Dance,Hasee Toh Phasee,9.5/10
Khaike Paan Banaras Wala,Kishore Kumar,Dance,Don,8.5/10
Tu Hi Haqeeqat,"Irshan Ashraf, Javed Ali, Shadaab Faridi",Romantic,Tum Mile,9.5/10
Tune Maari Entriyaan (Bangla Version),"Bappi Lahiri, Monali Thakur",Dance,Gunday,8.8/10
Yeh Kaisi Jagah,"Deepali Sathe, Zubeen Garg",Sad,Hamari Adhuri Kahani,9.5/10
Wada Karle Sajna Tere Bina,"Lata Mangeshkar, Mohammed Rafi",Romantic,Haath Ki Safai,8.7/10
Jhalla Wallah,Shreya Ghoshal,Dance,Ishaqzaade,9.1/10
Hamesha Tumko Chaha,"Kavita Krishnamurthy, Udit Narayan",Sad,Devdas,9.2/10
Mujhko Barsaat Bana Lo,Armaan Malik,Romantic,Junooniyat,9.3/10
Aaya Tere Dar Par,"Ahmed Hussain, Javed Hussain, Mohd Vakil, Mohd. Hussain",Devotional,Veer Zaara,9.3/10
Ho Nahi Sakta,Udit Narayan,Romantic,Diljale,8.7/10
Kaun Tujhe,Armaan Malik,Romantic,M.S. Dhoni-The Untold Story,9.6/10
Tere Liye,"Atif Aslam, Shreya Ghoshal",Dance,Prince,9.1/10
Tu Isaq Mera,"Meet Bros, Neha Kakkar",RomanticSensual,Hate Story 3,9.0/10
Shaam Shaandaar,Amit Trivedi,Dance,Shaandaar,9.3/10
Banjaara,Sukhwinder Singh,DanceRomantic,Ek Tha Tiger,9.1/10
Akkha India Janta Hai,Kumar Sanu,Romantic,Jaan Tere Naam,8.2/10
Tharki Chokro,Swaroop Khan,Dance,PK,8.6/10
Gale Lag Ja,"Banjyotsna, Javed Ali",DanceSensual,De Dana Dan,9.4/10
Aadat (Juda Hoke Bhi),Atif Aslam,Sad,Kalyug,9.3/10
Jane Kaise Kab Kahan Iqrar Ho Gaya,"Kishore Kumar, Lata Mangeshkar",Romantic,Shakti,8.9/10
Agar Tum Mil Jao,Shreya Ghoshal,Romantic,Zeher,8.9/10
Kaara Fankaara,"A.R. Rahman, Aaryan Dinesh Kanagaratnam, Ashima Mahajan, Hard Kaur, Kaly, Paroma Dasgupta, Shashaa Tirupati",Dance,Ok Jaanu,9.3/10
Chokra Jawaan,"Sunidhi Chauhan, Vishal Dadlani",Dance,Ishaqzaade,9.1/10
Didi Tera Devar Deewana,"Lata Mangeshkar, S.P. Balasubrahmanyam",Dance,Hum Aapke Hain Koun,7.9/10
Saiyan Re,"Mohammed Irfan, Palak Muchhal",Romantic,Nirdosh,9.7/10
Pal Pal Dil Ke Paas,Kishore Kumar,Romantic,Blackmail,8.8/10
Rail Gaddi,"Navraj Hans, Swati Sharrma",Dance,Tutak Tutak Tutiya,9.1/10
Ek Din Bik Jayega Mati Ke Mol,Mukesh,Dance,Dharam Karam,9.1/10
Main Koi Aisa Geet,Abhijeet,Dance,Yes Boss,9.4/10
Yeh Ishq Hai,Shreya Ghoshal,Dance,Jab We Met,9.4/10
Alizeh,"Alizeh Ash King, Arijit Singh, Shashwat Singh",Romantic,Ae Dil Hai Mushkil,9.7/10
Kaho Na Kaho,Amir Jamal,RomanticSensual,Murder,9.1/10
Hey Shona,"Shaan, Sunidhi Chauhan",DanceRomantic,Tara Rum Pum,9.3/10
Chalte Chalte,"Manohar Shetty, Preetha Mazumdar, Sonali Bhatawdekar, Udbhav",Dance,Mohabbatein,9.2/10
Iktara,"Amit Trivedi, Amitabh Bhattacharya, Kavita Seth",Romantic,Wake Up Sid,9.6/10
Aap Ki Nazron Ne Samjha,Lata Mangeshkar,Romantic,Anpadh,9.2/10
Tu Chahiye,Atif Aslam,Romantic,Bajrangi Bhaijaan,9.3/10
Ole Ole,Abhijeet,Dance,Ye Dillagi,9.1/10
Tutak Tutak Tutiya,"Kanika Kapoor, Malkit Singh, Sonu Sood",Dance,Tutak Tutak Tutiya,8.9/10
Meri Duniya Tu Hi Re,"Shaan, Shankar Mahadevan, Sonu Nigam",Dance,Heyy Babyy,9.0/10
Mujhko Yaad Sataye Teri,Himesh Reshammiya,Dance,Phir Hera Pheri,9.2/10
Jane Kahan Gaye Woh Din,Mukesh,Sad,Mera Naam Joker,8.8/10
Nonsense Ki Night,Mika Singh,Dance,Happy New Year,9.2/10
Daaru Desi,"Benny Dayal, Shalmali Kholgade",Dance,Cocktail,9.4/10
Fugly Fugly Kya Hai,Yo Yo Honey Singh,Dance,Fugly,9.4/10
Buddhu Sa Mann,"Amaal Mallik, Armaan Malik",Dance,Kapoor & Sons,9.4/10
Jiska Mujhe Tha Intezar,"Kishore Kumar, Lata Mangeshkar",Romantic,Don,8.2/10
Raat Ka Nasha,K. S. Chithra,Dance,Asoka,9.3/10
Zara Zara Touch Me,Monali Thakur,DanceSensual,Race,9.3/10
Wada Karo Nahi Chodoge,"Kishore Kumar, Lata Mangeshkar",Romantic,Aa Gale Lag Jaa,9.1/10
Sajde,"Arijit Singh, Gulzar, Nihira Joshi Deshpande",Romantic,Kill Dil,9.4/10
Khair Mangda,Atif Aslam,Sad,A Flying Jatt,9.3/10
Tere Naal Ishqa,Kailash Kher,Sad,Shivaay,9.4/10
Na Na Na Re,"Daler Mehndi, Sudesh Bhonsle",Dance,Mrityudaata,8.8/10
Tum Aa Gaye Ho Noor Aa Gaya Hai,"Kishore Kumar, Lata Mangeshkar",Romantic,Aandhi,9.0/10
Mujeh Naulakha Mangade,"Bappi Lahiri, Kishore Kumar",Dance,Sharaabi,7.6/10
Ainvayi Ainvayi,"Salim Merchant, Sunidhi Chauhan",Dance,Band Baaja Baaraat,9.3/10
Awaaz Deke,"Lata Mangeshkar, Mohammed Rafi",Romantic,Professor,8.3/10
Tum Tak,"A.R. Rahman, A.V. Pooja, Javed Ali, Kirti Sagathia",DanceRomantic,Raanjhanaa,9.4/10
Chitta Ve,"Babu Haabi, Bhanu Pratap, Shahid Mallya",Dance,Udta Punjab,8.9/10
Get Up Jawani,"Badshah, Yo Yo Honey Singh",Dance,International Villager,9.4/10
Ji Huzoori,"Deepali, Mithoon",Romantic,Ki & Ka,9.3/10
Dhingana,Mikha Singh,Dance,Raees,9.3/10
Sapna,Arijit Singh,Sad,Parmanu The Story of Pokhran,9.7/10
Bandeyaa,Jubin Nautiyal,Sad,Jazbaa,9.5/10
Maula Mere Lele Meri Jaan,"Krishna Beura, Salim Merchant",DevotionalSad,Chak De India,9.6/10
Rang De Basanti,"Daler Mehndi, K. S. Chithra",DancePatriotic,Rang De Basanti,9.4/10
Kundali,"Anita Gandharva, Meenal Jain, Meghna Mishra, Rani Kaur, Vaishnavi Mishra, Yashika Sikka, Yashita Sharma",Dance,Manmarziyaan,9.2/10
Shuru Kar,"Amit Mishra, Neha Bhasin, Rochak Kohli",Dance,Aiyaary,9.3/10
Tooh,"Mamta Sharma, Mika Singh, Shekhar, Vishal",Dance,Gori Tere Pyaar Mein,9.3/10
Main Tera Dhadkan Teri,"Hard Kaur, K.K., Sunidhi Chauhan",Dance,Ajab Prem Ki Ghazab Kahani,9.5/10
Le Gayi,Asha Bhosle,Dance,Dil Toh Pagal Hai,9.3/10
Le Gayi,Asha Bhosle,Dance,Dil To Pagal Hai,9.3/10
Aankhein Khuli,"Ishaan, Lata Mangeshkar, Manohar Shetty, Shweta Pandit, Sonali Bhatawdekar, Udbhav, Udit Narayan",Dance,Mohabbatein,9.2/10
Rang Barse,Amitabh Bachchan,Dance,Silsila,8.2/10
Gawah Hai Chand Tare,"Alka Yagnik, Kumar Sanu",Romantic,Damini,8.5/10
Aisa Kyun Maa,Sunidhi Chauhan,Sad,Neerja,9.7/10
Tu Hi Re,Hariharan,Romantic,,9.4/10
Mera Mann Kehne Laga,Falak Shabir,Dance,Nautanki Saala,9.6/10
Shut Up & Bounce,"Sunidhi Chauhan, Vishal Dadlani",Romantic,Dostana,9.2/10
One Two Three Four,"Hamsika Iyer, Vishal Dadlani",Dance,Chennai Express,9.3/10
Haseeno Ko Aate Hain,"Alka Yagnik, Udit Narayan",Dance,Lahoo Ke Do Rang,8.3/10
Kasam Khake Kaho,"Alka Yagnik, Kumar Sanu",Romantic,Dil Hai Tumhaara,8.6/10
Dil Ka Rishta,"Alka Yagnik, Kumar Sanu, Udit Narayan",Romantic,Dil Ka Rishta,9.0/10
Sajdaa,"Rahat Fateh Ali Khan, Richa Sharma, Shankar Mahadevan",Romantic,My Name is Khan,9.6/10
Mujhe Tumse Mohabbat Hai,"Shaan, Shreya Ghoshal",DanceRomantic,Tumsa Nahin Dekha,8.7/10
Tujhe Dekha To,"Kumar Sanu, Lata Mangeshkar",Romantic,Dilwale Dulhania Le Jayenge,9.1/10
Watan Wallon Watan Na,"Alka Yagnik, Shaan",Patriotic,Indian,9.1/10
Pani Da Rang,Ayushman Khurana,Romance,Vicky Donor,9.5/10
Tum Itna Jo Muskura Rahe Ho,Jagjit Singh,Romantic,Arth,9.2/10
Ham The Jinke Sahare,Lata Mangeshkar,Sad,Safar,8.8/10
Titli,"Chinmayi Sripaada, Gopi Sunder",Romantic,Chennai Express,9.5/10
Laung Da Lashkara,"Hard Kaur, Mahalakshmi Iyer",Dance,Patiala House,9.4/10
Maa Ka Phone,Priya Panchal,Dance,Khoobsurat,9.0/10
Zindagi Ka Safar,Kishore Kumar,Sad,Safar,9.1/10
O Saathiya,"Arko, Armaan Malik, Prakriti Kakkar",Romantic,Sweetiee Weds NRI,9.4/10
Kasam Ki Kasam,"K. S. Chithra, Shaan",RomanticSad,Main Prem Ki Diwani Hoon,9.2/10
Gun Gun Guna,"Sunidhi Chauhan, Udit Narayan",Dance,Agneepath,9.4/10
Jeeta Hoon Jiske Liye,"Alka Yagnik, Kumar Sanu",Romantic,Dilwale,7.8/10
Aye Khuda (Duet),"Rahat Fateh Ali Khan, Shreya Ghoshal",Sad,Rocky Handsome,9.5/10
Dreamum Wakeupum,Soumya Rai,Dance,Aiyyaa,9.1/10
Balma Tum Balma Ho Mere Khali,Kavita Krishnamurthy,Dance,Nagina,7.4/10
Ishq Bina,"A.R. Rahman, Anuradha Sriram, Sonu Nigam, Sujatha Mohan",Romantic,Taal,9.2/10
Ab Tere Bin,Kumar Sanu,Sad,Aashiqui,9.0/10
Ankhiyaan,Kanika Kapoor,Sad,Do Lafzon Ki Kahani,9.3/10
Teri Yaad,Ghulam Ali,Sad,Bewafaa,8.6/10
Jalwa,"Earl, Wajid",Dance,Wanted,8.9/10
Judaai,Falak Shabir,Sad,I Love New Year,9.5/10
Aayat,"Altamash Faridi, Arijit Singh, Farhan Sabri, Mujtaba Aziz Naza, Shadab",Sad,Bajirao Mastani,9.5/10
Dil Dooba,"Shreya Ghoshal, Sonu Nigam",Dance,Khakee,9.6/10
Pyaar Deewana Hota Hai,Kishore Kumar,Romantic,Kati Patang,9.1/10
Nazrein Mili Dil Dhadka,"Alka Yagnik, Udit Narayan",Dance,Raja,9.1/10
Po Po,"Aaman Trikha, Himesh Reshammiya, Vikas Bhalla",Dance,Son of Sardaar,7.7/10
Son Of Sardaar,"Aaman Trikha, Himesh Reshammiya",Dance,Son of Sardaar,7.7/10
Roobaroo,"A.R. Rahman, Naresh Iyer",Dance,Rang De Basanti,9.7/10
Khush Rahe Tu Sada,Mohammed Rafi,Sad,Khilona,8.3/10
Chaar Kadam,"Shaan, Shreya Ghoshal",Romantic,PK,9.1/10
Are Re Are,"Lata Mangeshkar, Udit Narayan",Dance,Dil To Pagal Hai,9.2/10
Shiddat,Armaan Malik,Sad,Sweetiee Weds NRI,9.4/10
Dil Kehta Hai,"Alka Yagnik, Kumar Sanu",Sad,Akele Hum Akele Tum,9.3/10
Dilnashin Dilnashin,K.K.,Dance,Aashiq Banaya Aapne,9.0/10
Sawaar Loon,Monali Thakur,Dance,Lootera,9.2/10
Zehnaseeb,"Chinmayi Sripaada, Shekhar Ravjiani",Dance,Hasee Toh Phasee,9.6/10
"Joote Do, Paise Lo","Lata Mangeshkar, S.P. Balasubrahmanyam",Dance,Hum Apke Hain Koun,7.7/10
Dekha Ek Khwab,"Kishore Kumar, Lata Mangeshkar",Romantic,Silsila,8.6/10
Maa,Shankar Mahadevan,Sad,Taare Zameen Par,9.6/10
Jogi Mahi,"Himani Kapoor, Shekhar Ravjiani, Sukhwinder Singh",Dance,Bachna Ae Haseeno,9.4/10
Mat Ja Re,Ankit Tiwari,Dance,Tanu Weds Manu,9.3/10
Ooh La La,"Bappi Lahiri, Shreya Ghoshal",Dance,The Dirty Picture,8.8/10
Bhangda Pa,"Asees Kaur, Divya Kumar, Vishal Dadlani",Dance,A Flying Jatt,9.0/10
Jhoka Hawa Ka Aaj Bhi,"Hariharan, Kavita Krishnamurthy",Sad,Hum Dil De Chuke Sanam,9.1/10
Dhol Baaje,"Anjjan, Meet Bros, Monali Thakur",Dance,Ek Paheli Leela,9.0/10
Aaj Hai Sagaai,"Abhijeet, Alka Yagnik",Dance,Pyaar To Hona Hi Tha,8.2/10
Galat Baat Hai,"Javed Ali, Neeti Mohan",DanceRomantic,Main Tera Hero,8.8/10
Yeh Ladka Hai Deewana,"Alka Yagnik, Udit Narayan",Dance,Kuch Kuch Hota Hai,9.5/10
Des Rangila,Mahalaxmi Iyer,DancePatriotic,Fanaa,8.8/10
Roshni Se,"Abhijeet, Alka Yagnik",Romantic,Asoka,9.4/10
I Love You,"Ash King, Clinton Cerejo",Romantic,Bodyguard,9.4/10
O Janiya,Neha Kakkar,Dance,Force 2,9.2/10
Mehndi Laga Ke Rakhna,"Lata Mangeshkar, Udit Narayan",Dance,Dilwale Dulhania Le Jayenge,9.2/10
Gori Gori,"Anu Malik, K.K., Shreya Ghoshal, Sunidhi Chauhan",Dance,Main Hoon Na,9.4/10
Gori Gori Gori Gori,"Anu Malik, Shreya Ghosal, Sunidhi Chauhan",Romantic,Main Hoon Na,9.4/10
Bakhuda Tumhi Ho,"Alka Yagnik, Atif Aslam",Romantic,Kismat Konnection,9.6/10
Ishq Hai Ishq Hai,Jayshree Shivram,Sad,Ishq,8.6/10
Prem Mein Tohre,Asha Bhosle,Romantic,Begum Jaan,9.2/10
Halo Re,Aaman Trikha,Dance,Prem Ratan Dhan Payo,8.5/10
Jogiya,"Anuradha Paudwal, Sukhwinder Singh",Sad,Deewane,8.4/10
Aila Re Aila,Daler Mehndi,Dance,Khatta Meetha,9.3/10
Hum Saath-Saath Hain,"Alka Yagnik, Anuradha Paudwal, Hariharan, Kavita Krishnamurthy, Kumar Sanu, Udit Narayan",Dance,Hum Saath-Saath Hain,7.5/10
Enu Naam Che Raees,Tarannum Mallik,Dance,Raees,9.4/10
Woh Pehli Baar,Shaan,Romantic,Pyaar Mein Kabhi Kabhi,9.5/10
Piya Aaye Na,"K.K., Tulsi Kumar",Sad,Aashiqui 2,9.3/10
Aaj Hai Sagai,"Abhijeet, Alka Yagnik",Dance,Pyar Toh Hona Hi Tha,8.2/10
Rajj Rajj Ke,"Sonakshi Sinha, Vishal Dadlani",Motivational,Akira,8.9/10
Daawat e Ishq,"Javed Ali, Sunidhi Chauhan",Dance,Daawat e Ishq,9.4/10
Tera Mera Pyar Amar,Lata Mangeshkar,Romantic,Asli Naqli,9.0/10
Chookar Mere Man Ko,Kishore Kumar,Romantic,Yaarana,9.3/10
Chookar Mere Man Ko,Kishore Kumar,Romantic,Yaarana,9.3/10
Love Is A Waste Of Time,"Shreya Ghoshal, Sonu Nigam",Dance,PK,8.8/10
Zindagi To Bewafa Hai,Mohammed Rafi,Sad,Muqaddar Ka Sikandar,8.3/10
Jo Tumko Ho Pasand Wohi Baat Karenge,Mukesh,Romantic,Safar,8.6/10
Bebo,Alisha Chinai,Dance,Kambakkht Ishq,9.0/10
Tum Bin,K. S. Chithra,Romantic,Tum Bin,9.0/10
Chot Lage Tujhko – Sad,"Alka Yagnik, Udit Narayan",Sad,Raja,8.4/10
Tujhe Sochta Hoon,K.K.,RomanticSensual,Jannat 2,9.6/10
Apni To Jaise Taise,Kishore Kumar,Dance,Laawaris,8.4/10
Mast Kalandar,"Master Saleem, Rehan Khan, Sajid Khan",Dance,Heyy Baby,9.5/10
Dhoom 3 Mashup,,Dance,Dhoom 3,8.1/10
It’s Magic,Taz,Dance,Koi Mil Gaya,8.8/10
It’s Magic,Taz,Dance,Koi Mil Gaya,8.8/10
Jigar Da Tukda,"Salim Merchant, Shraddha Pandit",Dance,Ladies Vs Ricky Bahl,9.3/10
It’s the Time to Disco,"K.K., Loy Mendonsa, Shaan, Vasundhara Das",Dance,Kal Ho Naa Ho,9.4/10
Maar Daala,Kavita Krishnamurthy,Dance,Devdas,9.2/10
Tumhe Apna Banane Ka,"Armaan Malik, Neeti Mohan",Romantic,Hate Story 3,8.9/10
Ho Gaya Hai Tujhko To Pyar Sajna,"Lata Mangeshkar, Udit Narayan",Romantic,Dilwale Dulhania Le Jayenge,9.2/10
Suno Aisha,"Amit Trivedi, Ash King, Nakash Aziz",Dance,Aisha,9.4/10
Jee Ve Sohaneya,Nooran Sisters,Sad,Jab Harry Met Sejal,9.6/10
Hai Junoon,K.K.,Dance,New York,9.3/10
Kuch To Hai,Armaan Malik,Sad,Do Lafzon Ki Kahani,9.6/10
Ban Dance Mein Kutta,"Divya Kumar, Shivi, Uvie",Dance,3 Dev,8.2/10
Bhooli Bisri Ek Kahani,Anuradha Paudwal,Sad,Nagina,8.2/10
Milan Abhi Aadha Adhura,"Shreya Ghoshal, Udit Narayan",Romantic,Vivah,8.5/10
Ishqyaun Dhishyaun,Aditya Narayan,Romantic,Goliyon Ki Rasleela Ram-leela,9.3/10
Maahi Ve,"Richa Sharma, Sukhwinder Singh",DanceSad,Kaante,9.2/10
Rangdaari,"Arko, Navraj Hans",Sad,Daas Dev,9.4/10
Rangdaari,"Arko, Navraj Hans",Sad,Daas Dev,9.4/10
Ye Tune Kya Kiya,Javed Bashir,Romantic,Once Upon A Time In Mumbaai Dobara,9.5/10
Chak De India,"Marianne D'Cruz, Salim Merchant, Sukhwinder Singh",DanceMotivationalPatriotic,Chak De India,9.3/10
Saanwali Si Ek Ladki,Udit Narayan,Romantic,Mujhse Dosti Karoge!,9.2/10
Dil Se Nikal Kar Dil Ko Gayee Hain,"Anuradha Paudwal, Suresh Wadkar",Dance,Nigahen,7.6/10
Dhak Dhak Karne Laga,"Anuradha Paudwal, Udit Narayan",Romantic,Beta,8.7/10
Kabhi Jo Badal Barse,Arijit Singh,Romantic,Jackpot,9.1/10
Bhar Do Jholi Meri,Adnan Sami,Devotional,Bajrangi Bhaijaan,9.2/10
Give Me Some Sunshine,"Sharman Joshi, Suraj Jagan",Sad,3 Idiots,9.6/10
Dil Leke,"Shaan, Shreya Ghoshal",DanceRomantic,Wanted,9.2/10
Yeh Mera Diwanapan Hai,Mukesh,Sad,Yahudi,9.2/10
O Jaana,"Alka Yagnik, K.K., Kamaal khan, Udit Narayan",DanceRomantic,Tere Naam,8.9/10
Love Mashup 2016 (Kiran Kamath),Multiple,Romantic,Single,9.6/10
Abhagi Piya Ki,"Ahmed Hussain, Kanika Kapoor, Mohammed. Hussain, Raja Hasan",Sad,Tera Intezaar,9.3/10
Rang Laal,"Aditi Singh Sharma, Dev Negi, John Abraham",Dance,Force 2,9.4/10
Bas Tu Hai,"Arijit Singh, Jonita Gandhi",RomanticSad,3 Storeys,9.2/10
Tanhaiyaan,Amit Mishra,Sad,Aksar 2,8.6/10
Jaane Kyun,Vishal Dadlani,Dance,Dostana,9.5/10
Dagabaaz Re,"Rahat Fateh Ali Khan, Shreya Ghoshal",Romantic,Dabangg 2,8.8/10
Jane Kyun,"Alka Yagnik, Udit Narayan",Romantic,Dil Chahta Hai,9.5/10
Khuli Falak Mein,Mohammed Rafi,Romantic,Professor,8.3/10
Sajna Mein Teri Tu Mera,"Anuradha Paudwal, Vipin Sachdeva",Romantic,Beta,8.8/10
Zindagi Do Pal Ki,K.K.,Romantic,Kites,9.4/10
Tauba Yeh Matwali Chaal,Mukesh,Dance,Pathar Ke Sanam,7.9/10
Main Hoon Hero Tera,Armaan Malik,Romantic,Hero,9.6/10
Daata Tu,Shreya Ghoshal,Motivational,Tiger Zinda Hai,9.2/10
Saathiya Nahi Jaana,"Lata Mangeshkar, Mohammed Rafi",RomanticSad,Aya Sawan Jhoom Ke,8.3/10
Ishq Hua,"Shreya Ghoshal, Sonu Nigam",Romantic,Aaja Nachle,9.4/10
Bloody Hell,Sunidhi Chauhan,Dance,Rangoon,9.2/10
Dil Se Re,"A.R. Rahman, Anupama Deshpande, Anuradha Sriram",Romantic,Dil Se,9.5/10
Phatte Tak Nachna,Sunidhi Chauhan,Dance,Dolly Ki Doli,9.3/10
Meer-E-Kaarwan,"Amit Mishra, Neeti Mohan",Sad,Lucknow Central,9.4/10
Raat Ka Nasha,K. S. Chithra,Dance,Ashoka,9.4/10
Maa Da Laadla,Master Saleem,Dance,Dostana,9.4/10
O Re Piya,Rahat Fateh Ali Khan,Sad,Aaja Nachle,9.3/10
Jhanjariya Meri Chanak,Alka Yagnik,Dance,Krishna,8.9/10
Pareshaan,Shalmali Kholgade,Romantic,Ishaqzaade,9.4/10
Paisa Paisa,"Manak-E, RDB, Selina",Dance,De Dana Dan,9.1/10
Mere Haath Mein,"Sonu Nigam, Sunidhi Chauhan",Romantic,Fanaa,9.4/10
Do Lafzon Ki Hai Dil Ki Kahani,"Amitabh Bachchan, Asha Bhosle, Sharad Kumar",Dance,The Great Gambler,9.1/10
Ishq Sufiyana (Male),Kamal Khan,Romantic,The Dirty Picture,9.3/10
Meri Maa,K.K.,Sad,Yaariyan,9.6/10
Zindagi Tujhse Kya Karen Shikvey,Amit Mishra,Sad,Zindagi Yeh Zindagi,9.4/10
Dance Pe Chance,"Labh Janjua, Sunidhi Chauhan",Dance,Rab Ne Bana Di Jodi,9.1/10
Tu Hi Hai,Armaan Malik,Romantic,Jagga Jasoos,9.4/10
Gehra Ishq,Shekhar Ravjiani,Romantic,Neerja,9.7/10
Love Me Love Me,"Amrita Kak, Wajid",Dance,Wanted,9.1/10
Saajna,Falak Shabir,Romantic,I Me Aur Main,9.6/10
Tere Ho Ke Rahenge,Arijit Singh,Romantic,Raja Natwarlal,9.5/10
Sai Baba Bolo (Album Version),"Anup Jalota, Anuradha Paudwal, Jani Baboo, Mohammed Rafi",Devotional,Shirdi Ke Sai Baba,8.7/10
Khudaya Ve Ishq Hai Kaisa,Salim Merchant,Sad,Luck,9.5/10
Pardesi Pardesi,"Bela, Suresh Wadkar",Sad,Raja Hindustani,8.6/10
Gulabi,"Jigar Saraiya, Priya Saraiya",Dance,Shuddh Desi Romance,9.5/10
Dus Bahane,"K.K., Shaan",Dance,Dus,9.5/10
Main Agar Kahoon,"Shreya Ghoshal, Sonu Nigam",Romantic,Om Shanti Om,9.6/10
Main Aisa Kyun Hoon,Shaan,Dance,Lakshya,9.7/10
Main Aisa Kyon Hoon,Shaan,Dance,Lakshay,9.7/10
Mein Chali Mein Chali,"Lata Mangeshkar, Mohammed Rafi",Romantic,Professor,8.6/10
Sharabi,"Nindy Kaur, Shekhar Ravjiani, Vishal Dadlani",Dance,Happy New Year,9.3/10
Labon Ka Karobaar,Papon,Romantic,Befikre,7.0/10
Main Kya Karoon,Nikhil Paul George,Dance,Barfi,9.6/10
Sawan Ka Mahina,"Lata Mangeshkar, Mukesh",Romantic,Milan,8.8/10
Taang Uthake,"Mamta Sharma, Mika Singh, Neeti Mohan, Sohail Sen",Dance,Housefull 3,9.0/10
Hamari Shaadi Mein,"Babul Supriyo, Shreya Ghoshal",Dance,Vivah,7.9/10
Ishq Risk,Rahat Fateh Ali Khan,Romantic,Mere Brother Ki Dulhan,9.4/10
Dil Vich Lagya,"Akriti Kakar, Kunal Ganjawala, Sonu Nigam",Dance,Chup Chup Ke,8.9/10
Khalbali,"A.R. Rahman, Mohammed Aslam, Nacim",Dance,Rang De Basanti,9.6/10
Safarnama,Lucky Ali,Dance,Tamasha,9.5/10
My Dil Goes Mmmm,"Gayatri Iyer, Shaan",Romantic,Salaam Namaste,9.4/10
Tu Hi Meri Shab Hai,K.K.,Romantic,Gangster,9.4/10
Koi Ladki Hai,"Lata Mangeshkar, Udit Narayan",Dance,Dil To Pagal Hai,8.9/10
Bheege Hont Tere,Kunal Ganjawala,RomanticSensual,Murder,8.1/10
Mere Samne Wali Khidki Mein,Kishore Kumar,DanceRomantic,Padosan,9.5/10
Is Mod Se Jaate Hain,"Kishore Kumar, Lata Mangeshkar",Romantic,Aandhi,9.0/10
Chandni O Meri Chandni,YRF,Dance,Chandni,8.9/10
Mere Khwabon Mein,Lata Mangeshkar,Romantic,Dilwale Dulhania Le Jayenge,9.2/10
Rock N Roll Soniye,"Mahalakshmi Iyer, Shaan, Shankar Ehsaan Loy, Shankar Mahadevan",Dance,Kabhi Alvida Naa Kehna,9.4/10
Keeda,"Himesh Reshammiya, Neeti Mohan",Dance,Action Jackson,8.7/10
Abhi Kuch Dino Se,Mohit Chauhan,Dance,Dil Toh Bachha Hai,9.6/10
Dheere Dheere (Remix),Yo Yo Honey Singh,Dance,Dheere Dheere,8.9/10
Dil Ne Ye Kaha Hai Dil Se,"Alka Yagnik, Sonu Nigam",RomanticSad,Dhadkan,9.0/10
Mohabbat Hai Kya Cheez,"Lata Mangeshkar, Suresh Wadkar",Romantic,Prem Rog,7.6/10
Soldier Soldier Meethi Baaten,"Alka Yagnik, Kumar Sanu",Dance,Soldier,9.0/10
Tum Bin,Shreya Ghoshal,Sad,Sanam Re,9.5/10
Tum Ho Mera Pyar,"K.K., Suzanne D'Mello",Romantic,Haunted,9.4/10
Dard Dilo Ke  (Reprise),Mohammed Irfan,Dance,The Xpose,8.7/10
Shirdi Wale Sai Baba,Mohammed Rafi,Devotional,Amar Akbar Anthony,8.8/10
Na Jane Kahan Se,"Amit Kumar, Kavita Krishnamurthy",Dance,Chaalbaaz,8.9/10
Bol Beliya,"Siddharth Mahadevan, Sunidhi Chauhan",Dance,Kill Dil,9.1/10
Jee Karda,"Labh Janjua, Suzanne D'Mello",Dance,Singh Is Kinng,9.3/10
Tum Bin,Ankit Tiwari,Sad,Tum Bin 2,9.4/10
Aadat,"Jubin Nautiyal, Raftaar, Shirley Setia",Romantic,Passengers,9.5/10
Tere Liye,Ankit Tiwari,Romantic,Sanam Re,9.5/10
Mera Rang De Basanti,"Manmohan Waris, Sonu Nigam",Patriotic,The Legend Of Bhagat Singh,9.5/10
Hum Tumhare Hain Sanam,"Anuradha Paudwal, Udit Narayan",Romantic,Hum Tumhare Hain Sanam,8.7/10
Nain Phisal Gaye,Payal Dev,Romantic,Welcome To New York,9.4/10
Boond Boond,Ankit Tiwari,Sad,Roy,9.4/10
Bipasha,"Shadab Faridi, Shraddha Pandit",Dance,Jodi Breakers,9.2/10
Dhoom Tana,"Abhijeet, Shreya Ghoshal",Dance,Om Shanti Om,9.4/10
Tu Hi Mera,Shafqat Amanat Ali,Romantic,Jannat 2,9.5/10
A B C D E F G H,"Hariharan, Shankar Mahadevan, Udit Narayan",Dance,Hum Saath-Saath Hain,7.9/10
Moh Moh Ke Dhaage,"Monali Thakur, Papon",Sad,Dum Laga Ke Haisha,9.4/10
ABCD Yaariyan,"Benny Dayal, Shefali Alvares",Dance,Yaariyan,9.3/10
Hona Tha Pyar,"Atif Aslam, Hadiqa Kiani",Romantic,Bol,9.6/10
ABCD,"Benny Dayal, Shefali Alvares, Yo Yo Honey Singh",Dance,Yaariyan,9.3/10
Kaise Mujhe,Benny Dayal,Romantic,Ghajini,9.6/10
Whats Up,"Jasleen Royal, Mika Singh",Dance,Phillauri,8.9/10
Masakali,Mohit Chauhan,Dance,Delhi-6,9.5/10
Tumhe Jo maine Dekha,Abhijeet,Dance,Main Hoon Na,9.5/10
Gal Ban Gayi (Remix),"Meet Bros, Neha Kakkar, Sukhbir, Yo Yo Honey Singh",Dance,Gal Ban Gayi,8.9/10
Koyal Si Teri Boli,"Anuradha Paudwal, Udit Narayan",Dance,Beta,8.1/10
Hum Lakh Chupaye,"Asha Bhosle, Kumar Sanu",Romantic,Jaan Tere Naam,8.6/10
Ek Villain,Multiple,Dance,Ek Villain,9.5/10
Tujhe Dekhti Hai Nazar,Mohd. Irfan,Romantic,Nanu Ki Jaanu,9.5/10
Beedi,"Clinton Cerejo, Nachiketa, Sukhwinder Singh, Sunidhi Chauhan",Dance,Omkara,9.3/10
Chori Chori Dil Le Gaya,"Hema Sardesai, Sukhwinder Singh",Dance,Garam Masala,9.1/10
Raasleela,Sumedha Karmahe,Dance,3 Storeys,9.3/10
Dum Maaro Dum,Anushka Manchanda,Dance,Dum Maaro Dum,9.2/10
Kudiyan Sehar Diyan,"Alka Yagnik, Daler Mehndi",Dance,Arjun Pandit,8.6/10
Dhunki,Neha Bhasin,Dance,Mere Brother Ki Dulhan,9.4/10
Tera Deedar Hua,Rahat Fateh Ali Khan,Romantic,Jannat 2,9.5/10
Salaam India,"Salim Merchant, Vishal Dadlani",MotivationalPatriotic,Mary Kom,9.6/10
Hum Ko Maaloom Hain,"Sadhana Sargam, Sonu Nigam",Romantic,Jaan-E-Mann,9.5/10
Bodyguard,"Band of Power, Salman Khan",Dance,Bodyguard,9.1/10
Pyaara Bhaiya Mera,"Alka Yagnik, Kumar Sanu",Dance,Kya Kehna,8.6/10
Chahoon Bhi,"Bombay Jayashri, Karthik",Romantic,Force,9.5/10
Babul Pyare,Lata Mangeshkar,Dance,Johny Mera Naam,7.5/10
Bade Miyan Chote Miyan,"Sudesh Bhosle, Udit Narayan",Dance,Bade Miyan Chote Miyan,8.9/10
Albela Sajan,"Kanika Joshi, Kunal Pandit, Prithvi Gandharva, Rashi Raagga, Shashi Suman",Dance,Bajirao Mastani,9.5/10
Nahin Saamne Tu,"Hariharan, Sukhwinder Singh",Romantic,Taal,9.5/10
Goron Ki Na Kalon Ki,"Suresh Wadkar, Usha Mangeshkar",Dance,Disco Dancer,9.0/10
Gum Hai Kisi Ke Pyar Mein,"Kishore Kumar, Lata Mangeshkar",Romantic,Raampur Ka Lakshman,9.2/10
Tu Mere Agal Bagal Hai,Mika,Dance,Phata Poster Nikhla Hero,9.0/10
Aashiyan,"Nikhil Paul George, Shreya Ghoshal",Dance,Barfi,9.6/10
Pyar Ka Anjaam,"Alka Yagnik, Kumar Sanu, Sapna Mukherjee",Romantic,Bewafaa,8.7/10
Ay Hairathe,"A.R. Rahman, Alka Yagnik, Hariharan, Mohammed Aslam",Romantic,Guru,9.5/10
Hip Hop Pammi,"Mika Singh, Monali Thakur",Dance,Ramaiya Vastavaiya,9.4/10
Jab Se Mere Naina,Shaan,DanceRomantic,Saawariya,9.6/10
Race Saanson Ki,"Neeraj, Sunidhi Chauhan",Dance,Race,9.3/10
Tu Chale Toh,Papon,Romantic,Qarib Qarib Singlle,8.9/10
Chori Chori Chupke Chupke,"Shreya Ghosal, Udit Narayan",DanceRomantic,Krrish,9.0/10
Pairon Mein Bandhan Hai,"Manohar Shetty, Preetha Mazumdar, Sonali Bhatawdekar, Udbhav",Dance,Mohabbatein,9.2/10
Tum Par Hum Hai Atke Yaara,"Kavita Krishnamurthy, Kumar Sanu",Dance,Pyaar Kiya To Darna Kya,8.8/10
So Gaya Yeh Jahan,"Alka Yagnik, Nitin Mukesh, Shabbir Kumar",Dance,Tezaab,8.7/10
Wo Ladki Jo Sabse,Abhijeet,Dance,Baadshah,9.4/10
Sara Zamana,Kishore Kumar,Dance,Yaarana,8.9/10
Aur Is Dil Mein,"Asha Bhosle, Suresh Wadkar",Sad,Imaandaar,9.0/10
Mujhse Shaadi Karogi,"Sonu Nigam, Sunidhi Chauhan, Udit Narayan",Dance,Mujhse Shaadi Karogi,9.2/10
Challa,"Babbu Maan, Suzanne D'Mello",Dance,Crook,9.3/10
Tu Hi Toh Meri Dost Hai,"A.R. Rahman, Benny Dayal, Shreya Ghoshal",Dance,Yuvvraaj,9.6/10
Maa Sheranwali,Shabbir Kumar,Devotional,Coolie,7.6/10
Kuch Din,Jubin Nautiyal,Romantic,Kaabil,9.3/10
Tu Na Ja Mere Badshah,"Alka Yagnik, Mohammad Aziz",Sad,Khuda Gawah,8.4/10
Rani Tu Mein Raja (,"Bhavya Pandit, Mika Singh, Yo Yo Honey Singh",Dance,Son of Sardaar,8.3/10
Rani Tu Mein Raja (,"Bhavya Pandit, Mika Singh, Yo Yo Honey Singh",Dance,Son of Sardaar,8.3/10
Bholi Si Surat,"Lata Mangeshkar, Udit Narayan",Romantic,Dil To Pagal Hai,9.3/10
Tere Naina,"Shaan, Shreya Ghoshal",Romantic,Jai Ho,9.2/10
O Rangrez,Divya Kumar,Romantic,Bhaag Milkha Bhaag,9.6/10
Jise Dekh Mera Dil Dhadke,Kumar Sanu,Romantic,Phool Aur Kaante,8.5/10
Tumko To Aana Hi Tha,"Armaan Malik, Marianne D'Cruz",Romantic,Jai Ho,9.5/10
Khwaab Ho Tum Ya Koi,Kishore Kumar,Romantic,Teen Deviyan,9.4/10
Chor Bazari,Neeraj Shridhar,Dance,Love Aj Kal,9.3/10
Saanson Ne,"Sonu Nigam, Tulsi Kumar",Romantic,Dabangg 2,9.0/10
Mr. Lova Lova,"Abhijeet, Kavita Krishnamurthy, Sudesh Bhosle, Udit Narayan, Vibha Sharma",Dance,Ishq,9.1/10
Ladka Yeh Kehta Hai,K.K.,Dance,Main Prem Ki Diwani Hoon,9.1/10
Tum Dil Ki Dhadkan Mein,"Abhijeet, Alka Yagnik, Kumar Sanu",Romantic,Dhadkan,9.0/10
Halla Re,"Salim Merchant, Shweta Pandit",Dance,Neal 'n' Nikki,9.1/10
Tu Bhoola Jise,K.K.,Patriotic,Airlift,9.7/10
Teri Yaad,"Badshah, Himesh Reshammiya",Sad,Teraa Surroor,9.0/10
Tum Saanson Mein,"Himesh Reshammiya, Tulsi Kumar",Romantic,Humko Deewana Kar Gaye,9.0/10
Yeh Jo Des Hai Tera,A.R. Rahman,Patriotic,Swades,9.6/10
Jab Tak Hai Jaan,Shakthi Sree Gopalan,Romantic,Jab Tak Hai Jaan,9.7/10
Teri Yaad Aati Hai,"Lata Mangeshkar, Suresh Wadkar",Sad,Saudagar,8.0/10
Jee Le Zaraa,Vishal Dadlani,Romantic,Talaash,9.4/10
Bekarar Karke Hume,Hemant Kumar,Romantic,Bees Saal Baad,9.5/10
Chichora Piya,"Himesh Reshammiya, Shalmali Kholgade",Dance,Action Jackson,8.7/10
Soniye Ve – Dhak Dhak Dhak,"Sonu Nigam, Sunidhi Chauhan",Dance,Kismat Konnection,9.4/10
Tere Bin,Atif Aslam,Sad,Bas Ek Pal,9.6/10
Phir Mohabbat,"Arijit Singh, Mohammed Irfan, Saim Bhat",RomanticSad,Murder 2,8.3/10
O Heeriye,Ayushman Khurana,Romance,Bewakoofiyan,9.6/10
O Heeriye,Ayushman Khurana,Sad,Bewakoofiyaan,9.6/10
Hummein Tummein Jo Tha,"Palak Muchhal, Papon",Sad,Raaz Reboot,9.2/10
Dil Chura Le,"Alka Yagnik, Kumar Sanu",Romantic,Dil Ka Rishta,9.0/10
Kaun Hai Jo Sapnon Mein Aaya,Mohammed Rafi,Romantic,Jhuk Gaya Aasman,9.2/10
Mar Jaawan Mit Jaawan,"Abhijeet Sawant, Sunidhi Chauhan",Dance,Aashiq Banaya Aapne,9.0/10
Mar Jaawan Mit Jaawan,"Abhijeet Sawant, Sunidhi Chauhan",Dance,Aashiq Banaya Aapne,9.0/10
