song,singer,genre,album,userRating
Aankh Marey,"Kumar Sanu, Mika Singh, Neha Kakkar",Dance,Simmba,8.8/10
Coca Cola,"Neha Kakkar, Tony Kakkar",DanceRomantic,Luka Chuppi,9.0/10
Apna Time Aayega,Ranveer Singh,Dance,Gully Boy,9.7/10
Mungda,"Jyotica Tangri, Shaan, Subhro Ganguly",Dance,Total Dhamaal,9.1/10
Tere Bin,"Asees Kaur, Rahat Fateh Ali Khan, Tanishk Bagchi",Romantic,Simmba,9.2/10
Gali Gali,Neha Kakkar,Dance,KGF,9.1/10
Chamma Chamma,"Arun, Ikka, Neha Kakkar, Romy",Dance,Fraud Saiyaan,9.2/10
Mere Gully Mein,Ranveer Singh,Dance,Gully Boy,9.5/10
Kamariya,Darshan Raval,Dance,Mitron,9.2/10
Ek Ladki Ko Dekha Toh Aisa Laga,"Darshan Raval, Rochak Kohli",Romantic,Ek Ladki Ko Dekha Toh Aisa Laga,9.6/10
Swag Se Swagat,"Neha Bhasin, Vishal Dadlani",Dance,Tiger Zinda Hai,8.8/10
Poster Lagwa Do,"Mika Singh, Sunanda Sharma",Dance,Luka Chuppi,8.4/10
Daaru Wargi,Guru Randhawa,Dance,Cheat India,9.1/10
Dilbar,"Dhvani Bhanushali, Ikka, Neha Kakkar",Dance,Satyameva Jayate,9.2/10
Proper Patola,"Aastha Gill, Badshah, Diljit Dosanjh",Dance,Namaste England,9.0/10
Doori,Ranveer Singh,Dance,Gully Boy,9.7/10
Dil Diyan Gallan,Atif Aslam,Romantic,Tiger Zinda Hai,9.1/10
Husn Parcham,"Bhoomi Trivedi, Raja Kumari",Dance,Zero,9.0/10
Bom Diggy Diggy,"Jasmin Walia, Zack Knight",Dance,Sonu Ke Titu Ki Sweety,9.0/10
Issaqbaazi,"Divya Kumar, Sukhwinder Singh",Dance,Zero,9.1/10
Mere Naam Tu,Abhay Jodhpurkar,Romantic,Zero,9.2/10
High Rated Gabru – Nawabzaade,Guru Randhawa,Dance,Nawabzaade,9.2/10
Dekhte Dekhte,Atif Aslam,Romantic,Batti Gul Meter Chalu,9.5/10
Zingaat,"Ajay, Atul",Dance,Dhadak,8.6/10
Mile Ho Tum (Reprise),"Neha Kakkar, Tony Kakkar",Romantic,Fever,9.0/10
Dil Chori,"Ishers, Simar Kaur, Yo Yo Honey Singh",Dance,Sonu Ke Titu Ki Sweety,9.0/10
Tere Naal Nachna,"Badshah, Sunanda Sharma",Dance,Nawabzaade,9.2/10
Dil Meri Na Sune,Atif Aslam,Romantic,Genius,9.5/10
Dhadak Title Track,"Ajay Gogavale, Shreya Ghoshal",Romantic,Dhadak,9.4/10
Heeriye,"Deep Money, Meet Bros, Neha Bhasin",DanceRomantic,Race 3,8.7/10
Chogada,"Asees Kaur, Darshan Raval",Dance,Loveratri,9.3/10
Gud Naal Ishq Mitha,"Harshdeep Kaur, Navraj Hans",Dance,Ek Ladki Ko Dekha Toh Aisa Laga,9.3/10
Paniyon Sa,"Atif Aslam, Tulsi Kumar",Romantic,Satyameva Jayate,9.5/10
Milegi Milegi,Mika Singh,Dance,Stree,9.1/10
Morni Banke,"Guru Randhawa, Neha Kakkar",Dance,Badhaai Ho,9.0/10
Bhare Bazaar,"B Praak, Badshah, Payal Dev, Vishal Dadlani",Dance,Namaste England,9.0/10
Khalibali,Shivam Pathak,Dance,Padmaavat,9.1/10
Aao Kabhi Haveli Pe,"Badshah, Jigar, Nikhita Gandhi, Sachin Sanghvi",Dance,Stree,8.4/10
Badri Ki Dulhania,"Dev Negi, Ikka, Monali Thakur, Neha Kakkar",Dance,Badrinath Ki Dulhania,8.4/10
Cheez Badi,"Neha Kakkar, Udit Narayan",Dance,Machine,8.8/10
Dholida,"Neha Kakkar, Palak Muchchal, Raja Hassan, Udit Narayan",Dance,Loveratri,9.2/10
Sweetheart,Dev Negi,Dance,Kedarnath,9.2/10
Namo Namo,Amit Trivedi,Devotional,Kedarnath,9.6/10
Qaafirana,"Arijit Singh, Nikhita Gandhi",Romantic,Kedarnath,9.6/10
Tu Hi Re,"Armaan Malik, Shashaa Tirupati",Dance,2,9.0/10
Chhote Chhote Peg,"Navraj Hans, Neha Kakkar, Yo Yo Honey Singh",Dance,Sonu Ke Titu Ki Sweety,9.1/10
Galti Se Mistake,"Amit Mishra, Arijit Singh",Dance,Jagga Jasoos,8.5/10
Phir Mulaaqat,Jubin Nautiyal,Romantic,Cheat India,9.5/10
Kala Chashma,"Amar Arshi, Badshah, Neha Kakkar",Dance,Baar Baar Dekho,8.5/10
Nashe Si Chadh Gayi,Arijit Singh,Dance,Befikre,8.9/10
Mera Pyar Tera Pyar,Arijit Singh,RomanticSad,Jalebi,9.6/10
Ding Dang,"Amit Mishra, Antara Mitra",Dance,Munna Michael,8.5/10
Main Tera Boyfriend,"Arijit Singh, Meet Bros, Neha Kakkar",Dance,Raabta,9.1/10
Laila Main Laila,Pawni Pandey,Dance,Raees,8.7/10
Ghoomar,"Shreya Ghoshal, Swaroop Khan",Dance,Padmaavat,8.6/10
Rafta Rafta Medley,"Akash Ojha, Disha Sharma, Jordi Patel, Rekha, Sonakshi Sinha, Vishal Mishra",Dance,Yamla Pagla Deewana Phir Se,9.3/10
Pal,"Arijit Singh, Shreya Ghoshal",Romantic,Jalebi,9.7/10
Patola,Guru Randhawa,Dance,Black Mail,8.9/10
Pallo Latke,"Fazilpuria, Jyotica Tangri, Yasser Desai",Dance,Shaadi Mein Zaroor Aana,9.0/10
Billionaire,"Simar Kaur, Singhsta, Yo Yo Honey Singh",Dance,Baazaar,9.3/10
This Party Is Over Now,Yo Yo Honey Singh,Dance,Mitron,9.3/10
Heer Badnaam,Romy,DanceSad,Zero,9.1/10
Tera Hua,Atif Aslam,Romantic,Loveratri,9.0/10
Jaan Nisaar,Arijit Singh,Romantic,Kedarnath,9.7/10
Akh Lad Jaaye,"Asees Kaur, Badshah, Jubin Nautiyal",DanceRomantic,Loveratri,9.2/10
Rangtaari,"Dev Negi, Yo Yo Honey Singh",Dance,Loveratri,9.1/10
The Humma Song,"Badshah, Jubin Nautiyal, Shashaa Tirupati",Dance,Ok Jaanu,9.0/10
Pehli Baar,Ajay Gogavale,Romantic,Dhadak,8.9/10
Tera Yaar Hoon Main,Arijit Singh,RomanticSad,Sonu Ke Titu Ki Sweety,9.5/10
Chhod Diya,Arijit Singh,Sad,Baazaar,9.7/10
Maine Tujhko Dekha,"Neeraj Shridhar, Sukriti Kakar",Dance,Golmaal Again,9.0/10
Allah Duhai Hai,"Amit Mishra, Jonita Gandhi, Sreerama Chandra",Dance,Race 3,8.1/10
Cham Cham,Monali Thakur,Dance,Baaghi,8.1/10
Kar Har Maidaan Fateh,"Shreya Ghoshal, Sukhwinder Singh",Motivational,Sanju,9.5/10
Kamariya,"Aastha Gill, Divya Kumar, Jigar Saraiya, Sachin Sanghvi",Dance,Stree,9.1/10
Tamma Tamma Again,"Anuradha Paudwal, Badshah, Bappi Lahiri",Dance,Badrinath Ki Dulhania,8.6/10
Tera Fitoor,Arijit Singh,Romantic,Genius,9.4/10
Mere Rashke Qamar,"Nusrat Fateh Ali Khan, Rahat Fateh Ali Khan",Romantic,Baadshaho,9.0/10
The Breakup Song,"Arijit Singh, Badshah, Jonita Gandhi, Nakash Aziz",Dance,Ae Dil Hai Mushkil,9.0/10
Naino Ne Bandhi,Yasser Desai,Romantic,Gold,9.6/10
Sanu Ek Pal Chain,Rahat Fateh Ali Khan,Romantic,Raid,9.3/10
Ban Ja Rani,Guru Randhawa,DanceRomantic,Tumhari Sulu,9.0/10
Zaalima,"Arijit Singh, Harshdeep Kaur",DanceRomantic,Raees,9.2/10
Baarish,"Ash King, Shashaa Tirupati",Romantic,Half Girlfriend,9.3/10
Aashiq Banaya Aapne,"Himesh Reshammiya, Neha Kakkar",Dance,Hate Story 4,9.1/10
Ek Do Teen Song,Shreya Ghoshal,Dance,Baaghi 2,8.6/10
Tere Liye,"Akanksha Bhandari, Atif Aslam",Romantic,Namaste England,9.5/10
Nazam Nazam,"Arko, Ayushman Khurana",Romance,Bareilly Ki Barfi,9.5/10
O Saathi,"Atif Aslam, Payal Dev",Romantic,Baaghi 2,9.4/10
Tere Jaisa,"Arko, Tulsi Kumar",Romantic,Satyameva Jayate,9.2/10
Mera Intkam Dekhegi,Krishna Beuraa,Sad,Shaadi Mein Zaroor Aana,9.6/10
Gerua,"Antara Mitra, Arijit Singh",Romantic,Dilwale,9.3/10
Suraiyya,"Shreya Ghoshal, Vishal Dadlani",Dance,Thugs of Hindostan,7.7/10
Gold Tamba,Nakash Aziz,Dance,Batti Gul Meter Chalu,9.2/10
Ae Dil Hai Mushkil,Arijit Singh,Sad,Ae Dil Hai Mushkil,9.3/10
Prem Ratan Dhan Payo,Palak Muchhal,DanceRomantic,Prem Ratan Dhan Payo,7.7/10
Mohabbat,Sunidhi Chauhan,Dance,Fanney Khan,9.0/10
Nainowale Ne,Neeti Mohan,Romantic,Padmaavat,9.5/10
Mummy Kasam,"Gurinder Seagal, Payal Dev",Dance,Nawabzaade,9.4/10
Nasha,Amit Gupta,Sensual,Game Paisa Ladki,9.0/10
Bulleya,"Amit Mishra, Shilpa Rao",DanceSad,Ae Dil Hai Mushkil,9.2/10
Kar Gayi Chull,"Badshah, Fazilpuria, Neha Kakkar, Sukriti Kakar",Dance,Kapoor & Sons,9.0/10
Musafir,"Atif Aslam, Palak Muchhal",Sad,Sweetiee Weds NRI,9.4/10
Binte Dil,Arijit Singh,Dance,Padmaavat,9.4/10
Halka Halka,"Divya Kumar, Sunidhi Chauhan",Romantic,Fanney Khan,9.1/10
Humsafar,"Akhil Sachdeva, Mansheel Gujral",RomanticSad,Badrinath Ki Dulhania,9.3/10
Chad Gayi Hai,"Jigar, Sachin Sanghvi, Vishal Dadlani",Dance,Gold,9.2/10
Tum Mere Ho,"Amrita Singh, Jubin Nautiyal",Sensual,Hate Story 4,9.1/10
Bole Chudiyan,"Alka Yagnik, Amit Kumar, Kavita Krishnamurthy, Sonu Nigam, Udit Narayan",DanceRomantic,Kabhi Khushi Kabhie Gham,9.0/10
Sawarne Lage,Jubin Nautiyal,Romantic,Mitron,9.8/10
Chalti Hai Kya 9 Se 12,"Dev Negi, Neha Kakkar",Dance,Judwaa 2,8.9/10
Selfish,"Atif Aslam, Iulia Vantur",Romantic,Race 3,6.8/10
Oonchi Hai Building,"Anu Malik, Neha Kakkar",Dance,Judwaa 2,8.9/10
Shikwa Nahin Kisi Se,Kumar Sanu,Sad,Naseeb,8.2/10
Sanam Re,Arijit Singh,Romantic,Sanam Re,8.7/10
Dekha Hai Pehli Baar,"Alka Yagnik, S.P. Balasubrahmanyam",Dance,Saajan,8.2/10
Phir Bhi Tumko Chaahunga,"Arijit Singh, Shashaa Tirupati",Sad,Half Girlfriend,9.4/10
Suit Suit,"Arjun, Guru Randhawa",Dance,Hindi Medium,9.0/10
Nachange Saari Raat,"Meet Bros, Neeraj Shridhar, Tulsi Kumar",Dance,Junooniyat,8.9/10
Ishq Di Baajiyan,Diljit Dosanjh,Romantic,Soorma,9.9/10
Hard Hard,"Mika Singh, Prakriti Kakar, Sachet Tandon",Dance,Batti Gul Meter Chalu,8.7/10
Udi Udi Jaye,"Bhoomi Trivedi, Karsan Sagathia, Sukhwinder Singh",Dance,Raees,8.9/10
Nazar Na Lag Jaaye,"Ash King, Jigar, Sachin Sanghvi",Romantic,Stree,9.6/10
Nachle Na,"Guru Randhawa, Neeti Mohan",Dance,Dil Juunglee,9.5/10
Hatt Ja Tau,Sunidhi Chauhan,Dance,Veerey Ki Wedding,8.7/10
Chittiyaan Kalaiyaan,"Anjjan, Kanika Kapoor, Meet Bros",Dance,Roy,8.4/10
La La La (Baazaar),"Bilal Saeed, Neha Kakkar",DanceRomantic,Baazaar,9.5/10
Tujhse Kahan Judaa Hoon Main,"Himesh Reshammiya, Neeti Mohan, Vineet Singh",Sad,Genius,9.3/10
Hua Hain Aaj Pehli Baar,"Armaan Malik, Palak Muchhal",Romantic,Sanam Re,8.3/10
Jay-Jaykara,Kailash Kher,Sad,Baahubali 2 - The Conclusion,9.2/10
Hawa Hawa,"Mika Singh, Prakriti Kakkar",Dance,Mubarakan,8.9/10
Bhangra Ta Sajda,"Neha Kakkar, Romy, Shashwat Sachdev, Surya Ragunaathan",Dance,Veere Di Wedding,8.7/10
Deewani Mastani,"Ganesh Chandanshive, Shreya Ghoshal",Dance,Bajirao Mastani,9.1/10
O Meri Laila,"Atif Aslam, Jyotica Tangri",Romantic,Laila Majnu,9.6/10
Lo Safar,Jubin Nautiyal,Romantic,Baaghi 2,9.4/10
Chalte Chalte,Atif Aslam,Romantic,Mitron,9.6/10
Party Chale On,"Iulia Vantur, Mika Singh",Dance,Race 3,8.6/10
Sweety Tera Drama,"Dev Negi, Pawni Pandey, Shraddha Pandit",Dance,Bareilly Ki Barfi,9.1/10
Ek Dil Ek Jaan,Shivam Pathak,Romantic,Padmaavat,9.2/10
Ae Watan,Arijit Singh,Patriotic,Raazi,9.6/10
Sunn Le Zara,Arnab Dutta,Sad,1921,9.6/10
Naam Hai Mera,Neeti Mohan,RomanticSad,Hate Story 4,8.8/10
Jiyo Re Baahubali,"Daler Mehndi, Ramya Behara, Sanjeev Chimmalgi",Dance,Baahubali 2,8.7/10
Soniye Dil Nayi,"Ankit Tiwari, Shruti Pathak",RomanticSad,Baaghi 2,9.4/10
Mundiyan,"Navraj Hans, Palak Muchhal",Dance,Baaghi 2,9.0/10
Chitthi Aai Hai,Pankaj Udhas,Sad,Naam,8.1/10
Hawayein,Arijit Singh,Romantic,Jab Harry Met Sejal,9.6/10
Channa Mereya,Arijit Singh,Sad,Ae Dil Hai Mushkil,9.3/10
Lag Ja Gale,Jonita Gandhi,Romantic,Saheb Biwi Aur Gangster 3,9.4/10
Sleepy Sleepy Akiyaan,"Asees Kaur, Yasser Desai",Dance,Bhaiaji Superhit,9.2/10
Subah Subah,"Amaal Mallik, Arijit Singh, Prakriti Kakkar",Dance,Sonu Ke Titu Ki Sweety,9.5/10
Naina Da Kya Kasoor,Amit Trivedi,Romantic,Andha Dhun,9.6/10
Soorma Anthem,Shankar Mahadevan,Motivational,Soorma,9.9/10
Agar Tum Saath Ho,"Alka Yagnik, Arijit Singh",Sad,Tamasha,9.4/10
Tum Se,Jubin Nautiyal,RomanticSad,Jalebi,9.7/10
Kem Cho,"Ikka, Jyotica Tangri",Dance,Baazaar,9.4/10
Aaj Se Teri,Arijit Singh,Romantic,Padman,9.4/10
Maana Ke Hum Yaar Nahin,Parineeti Chopra,Romantic,Meri Pyaari Bindu,9.5/10
Nain Na Jodeen,"Ayushmann Khurrana, Neha Kakkar, Rochak Kohli",RomanticSad,Badhaai Ho,9.3/10
Wajah Tum Ho,"Altamash Faridi, Mithoon, Tulsi Kumar",RomanticSadSensual,Wajah Tum Ho,8.1/10
Pyaar De,Ankit Tiwari,Romantic,Beiimaan Love,8.5/10
Ik Vaari Aa,Arijit Singh,Romantic,Raabta,9.4/10
Radha,"Shekhar Ravjiani, Shreya Ghoshal, Udit Narayan, Vishal Dadlani",Dance,Student of the Year,8.6/10
Mehbooba,"Mohammed Rafi, Neha Kakkar, Yasser Desai",Dance,Fukrey Returns,9.4/10
Hamari Adhuri Kahani,Arijit Singh,Sad,Hamari Adhuri Kahani,9.3/10
Tere Sang Yaara,Atif Aslam,Romantic,Rustom,9.1/10
Radha,"Shahid Mallya, Sunidhi Chauhan",Romantic,Jab Harry Met Sejal,9.2/10
Kamli,Sunidhi Chauhan,Dance,Dhoom 3,9.0/10
Maiya Yashoda,"Alka Yagnik, Anuradha Paudwal, Kavita Krishnamurthy",Dance,Hum Saath-Saath Hain,7.2/10
Lae Dooba,Sunidhi Chauhan,Sad,Aiyaary,9.7/10
Abhi Toh Party Shuru Hui Hai,"Aastha Gill, Badshah",Dance,Khoobsurat,8.5/10
Hello Hello,Rekha Bhardwaj,Dance,Pataakha,7.7/10
Bola Har Har Har,"Aaman Trikha, Badshah, Sukhwinder Singh",Devotional,Shivaay,9.3/10
Bolo Har Har Har,"Anugrah, Badshah, Megha Sriram Dalton, Mithoon, Mohit Chauhan, Sukhwinder Singh",Dance,Shivaay,9.3/10
Tera Mera Rishta,"KK, Shreya Ghoshal",Romantic,Jalebi,9.7/10
Gal Ban Gayi,"Meet Bros, Neha Kakkar, Sukhbir Singh, Yo Yo Honey Singh",Dance,Single,9.0/10
Bol Do Na Zara,Armaan Malik,Romantic,Azhar,9.2/10
Lakk Mera Hit,"Mannat Noor, Rochak Kohli, Sukriti Kakar",Dance,Sonu Ke Titu Ki Sweety,9.2/10
Sexy Baliye,Mika Singh,Dance,Dil Chahta Hai,8.8/10
Main Jahaan Rahoon,Rahat Fateh Ali Khan,Sad,Namastey London,9.1/10
Hasi Ban Gaye,Shreya Ghoshal,Romantic,Hamari Adhuri Kahani,9.3/10
Nachde Ne Saare,"Harshdeep Kaur, Jasleen Royal, Siddharth Mahadevan",Dance,Baar Baar Dekho,9.2/10
Manma Emotion Jaage,"Amit Mishra, Antara Mitra, Anushka Manchanda",DanceRomantic,Dilwale,9.0/10
Theher Ja,Armaan Malik,Romantic,October,9.6/10
Boond Boond,"Jubin Nautiyal, Neeti Mohan",Romantic,Hate Story 4,9.3/10
Adhura Lafz,"Pratibha Singh Baghel, Rahat Fateh Ali Khan",Romantic,Baazaar,9.7/10
Trippy Trippy,"Badshah, Benny Dayal, Brijesh Shandilya, Neha Kakkar",Dance,Bhoomi,8.5/10
Tukur Tukur,"Arijit Singh, Kanika Kapoor, Nakash Aziz, Neha Kakkar, Siddharth Mahadevan",Dance,Dilwale,8.9/10
Teri Khair Mangdi,Bilal Saeed,Sad,Baar Baar Dekho,9.6/10
Pinga,"Shreya Ghoshal, Vasihali Made",Dance,Bajirao Mastani,8.7/10
Tere Thumke Sapna Chaudhary,"Gunwant Sen, Khushboo Jain, Saumya Upadhyay",Dance,Nanu Ki Jaanu,9.2/10
Badnaamiyan,Armaan Malik,Romantic,Hate Story 4,9.2/10
Malhari,Vishal Dadlani,Dance,Bajirao Mastani,9.1/10
High Heels Te Nachche,"Aditi Singh Sharma, Jaz Dhami, Meet Bros",Dance,Ki & Ka,8.7/10
Shake Karaan,"Kanika Kapoor, Meet Bros",Dance,Munna Michael,8.9/10
Thodi Der,"Farhan Saeed, Shreya Ghoshal",Sad,Half Girlfriend,9.4/10
Har Dil Jo Pyar Karega,"Alka Yagnik, Udit Narayan",Dance,Har Dil Jo Pyar Karega,8.4/10
Raabta,Nikhita Gandhi,Romantic,Raabta,9.0/10
Nach Meri Jaan,"Dev Negi, Kamaal khan, Nakash Aziz, Tushar Joshi",Dance,Tubelight,9.1/10
Janam Janam,"Antara Mitra, Arijit Singh",Romantic,Dilwale,9.4/10
Andha Dhun,Raftaar,Dance,Andha Dhun,9.6/10
Holi Biraj Ma,Jubin Nautiyal,Dance,Genius,9.3/10
Kal Ho Naa Ho Title Track,Sonu Nigam,Sad,Kal Ho Naa Ho,9.5/10
Enna Sona,"A.R. Rahman, Arijit Singh",Romantic,Ok Jaanu,9.5/10
Little Little,Harrdy Sandhu,Dance,Yamla Pagla Deewana Phir Se,9.2/10
Disco Disco,"Benny Dayal, Shirley Setia",Dance,A Gentleman,8.9/10
Lambiyaan Si Judaiyaan,"Altamash Faridi, Arijit Singh, Shadaab Faridi",Sad,Raabta,9.6/10
Aahista,"Arijit Singh, Jonita Gandhi",Romantic,Laila Majnu,9.4/10
Kisi Se Tum Pyaar Karo,"Alka Yagnik, Kumar Sanu",Romantic,Andaaz,8.6/10
Sultan Title Song,"Shadaab Faridi, Sukhwinder Singh",Motivational,Sultan,8.9/10
Radio,"Amit Mishra, Kamaal khan",Dance,Tubelight,8.6/10
Sab Badhiya Hai,Sukhwinder Singh,Dance,Sui Dhaaga,9.2/10
Chin Chin Chu,"Jassi Gill, Sonakshi Sinha",Dance,Happy Phirr Bhaag Jayegi,8.7/10
Beat Pe Booty,"Jigar Saraiya, Kanika Kapoor, Sachin Sanghvi, Vayu",Dance,A Flying Jatt,8.9/10
Jag Ghoomeya,Rahat Fateh Ali Khan,Romantic,Sultan,8.7/10
Jogi,"Aakanksha Sharma, Yasser Desai",Romantic,Shaadi Mein Zaroor Aana,9.6/10
Lets Nacho,"Badshah, Benny Dayal",Dance,Kapoor & Sons,9.2/10
Tu Tu Hai Wahi,"Asha Bhosle, Kishore Kumar",Romantic,Yeh Vaada Raha,9.2/10
Yeh Vaada Raha,"Asha Bhosle, Kishore Kumar",Dance,Yeh Vaada Raha,9.2/10
Vande Mataram,"Badshah, Daler Mehndi, Divya Kumar, Tanishka Sanghvi",Dance,ABCD 2,9.4/10
Jeene Laga Hoon,Atif Aslam,Romantic,Ramaiya Vastavaiya,9.0/10
Nit Khair Manga,Rahat Fateh Ali Khan,Romantic,Raid,9.4/10
Jitni Dafa,"Jeet Gannguli, Yasser Desai",Romantic,Parmanu The Story of Pokhran,9.7/10
Wajah Tum Ho,Armaan Malik,RomanticSensual,Hate Story 3,8.8/10
Rozana,Shreya Ghoshal,Romantic,Naam Shabana,9.6/10
Tu Meri Main Tera,"Altamash Faridi, Rahat Fateh Ali Khan, Shadab Faridi",RomanticSad,Namaste England,9.4/10
Gallan Goodiyaan,"Farhan Akhtar, Manish Kumar Tipu, Shankar Mahadevan, Sukhwinder Singh, Yashita Sharma",Dance,Dil Dhadakne Do,8.9/10
Swag Se Swagat (Arabic),"Brigitte Yaghi, Neha Bhasin, Rabih Baroud, Vishal Dadlani",Dance,Tiger Zinda Hai,9.4/10
Kudiya Shehar Diyan,"Daler Mehndi, Neha Kakkar",Dance,Poster Boys,9.0/10
Kudiya Shehar Diyan,"Daler Mehndi, Neha Kakkar",Dance,Poster Boys,9.0/10
Aap Se Milkar,"Aakanksha Sharma, Ayushmann Khurrana",Romantic,Andha Dhun,9.5/10
Socha Hai,"Jubin Nautiyal, Neeti Mohan",Romantic,Baadshaho,9.5/10
Sawan Aaya Hai (Unplugged Version),"Neha Kakkar, Tony Kakkar",Sad,Creature 3D,9.3/10
Pehle Ke Jaisa,K.K.,Sad,Jalebi,9.7/10
Main Woh Chaand,Darshan Raval,RomanticSad,Teraa Surroor,9.0/10
Ankhiyon Se Goli Mare,"Jaspinder Narula, Sonu Nigam",Dance,Dulhe Raja,8.2/10
Jab Tak,"Amaal Mallik, Armaan Malik",Romantic,M.S. Dhoni,9.4/10
Luv Letter,"Kanika Kapoor, Meet Bros",Dance,The Legend of Michael Mishra,9.1/10
Yaad Hai Na,Arijit Singh,Romantic,Raaz Reboot,9.1/10
Balma,"Rekha Bhardwaj, Sunidhi Chauhan",Dance,Pataakha,9.2/10
Kisi Se Pyar Ho Jaye,Jubin Nautiyal,DanceRomantic,Kaabil,9.2/10
Sau Aasmaan,"Armaan Malik, Neeti Mohan",Dance,Baar Baar Dekho,9.4/10
Beparwah,"Nandini Deb, Siddharth Basrur",Dance,Munna Michael,9.0/10
Yaad Hai,"Ankit Tiwari, Palak Muchhal",Sad,Aiyaary,9.7/10
Dhayaan Chand,"Amit Trivedi, Nikhita Gandhi, Suhas Sawant, Vijay Yamla",Dance,Manmarziyaan,9.4/10
Aaj Zid,Arijit Singh,Sensual,Aksar 2,9.1/10
Hum Pyaar Hai Tumhare,"Alka Yagnik, Kumar Sanu",Romantic,Haan Maine Bhi Pyaar Kiya,8.8/10
Main Hoon,Siddharth Mahadevan,Dance,Munna Michael,9.1/10
Swag Saha Nahi Jaye,"Neha Bhasin, Shadab Faridi, Sohail Sen",Dance,Happy Phirr Bhaag Jayegi,9.1/10
Chote Bade,"Ankit Tiwari, Mika Singh",Dance,Fry Day,8.7/10
Main Hoon Saath Tere,Arijit Singh,Romantic,Shaadi Mein Zaroor Aana,9.7/10
Kabira,"Rekha Bhardwaj, Tochi Raina",Sad,Yeh Jawaani Hai Deewani,9.4/10
Main Kaun Hoon,Meghna Mishra,Sad,Secret Superstar,9.5/10
Aashiq Surrender Hua,"Amaal Mallik, Shreya Ghoshal",Dance,Badrinath Ki Dulhania,8.8/10
Nachan Farrate,"Kanika Kapoor, Meet Bros",Dance,All is Well,8.9/10
Pyar De Pyar Le,"Dev Negi, Ikka, Iulia Vantur",Dance,Genius,9.3/10
Do Peg Maar,Neha Kakkar,Dance,One Night Stand,8.5/10
Jaanu,"Juggy D, Raftaar, Shivi",Dance,Behen Hogi Teri,9.2/10
Hamdard,Arijit Singh,Romantic,Ek Villain,9.5/10
Hawa Hawai 2.0,"Kavita Krishnamurthy, Shashaa Tirupati",Dance,Tumhari Sulu,8.9/10
Dhoom Dhadakka,"Antara Mitra, Shahid Mallya",Dance,Namaste England,9.1/10
Lovely,"Fateh, Kanika Kapoor, Miraya Varma, Ravindra Upadhyay",Dance,Happy New Year,9.3/10
Mohabbat Nasha Hai,"Neha Kakkar, Tony Kakkar",Sad,Hate Story 4,9.4/10
Chal Wahan Jaate Hain,Arijit Singh,Romantic,Heropanti,9.3/10
Ishq De Fanniyar,Jyotica Tangri,Romantic,Fukrey Returns,9.6/10
Palat Tera Hero Idhar Hai,Arijit Singh,DanceRomantic,Main Tera Hero,8.8/10
Tab Bhi Tu,Rahat Fateh Ali Khan,Sad,October,9.6/10
Yeh Ladka Hai Allah,"Alka Yadnik, Udit Narayan",Dance,Kabhi Khushi Kabhie Gham,9.1/10
Tujhe Yaad Na Meri Aayee,"Alka Yagnik, Manpreet Akhtar, Udit Narayan",Sad,Kuch Kuch Hota Hai,8.8/10
Jalte Diye,"Anwesshaa, Harshdeep Kaur, Shabab Sabri, Vineet Singh",Romantic,Prem Ratan Dhan Payo,8.8/10
Zindagi Bana Loon,Palak Muchhal,Romantic,Sweetiee Weds NRI,9.4/10
Humnava,Papon,Sad,Hamari Adhuri Kahani,9.4/10
Galliyan,Ankit Tiwari,Romantic,Ek Villain,9.4/10
Tere Chehre Mein Woh Jaadu Hai,Kishore Kumar,Romantic,Dharmatma,8.1/10
Golmaal Again Title Track,"Aditi Singh Sharma, Brijesh Shandilya",Dance,Golmaal Again,9.0/10
Suno Ganpati Bappa Morya,Amit Mishra,Dance,Judwaa 2,8.5/10
Dil Dene Ki Ruth,"Alka Yagnik, Vinod Rathod",Dance,Prem Granth,7.5/10
Soch Na Sake,"Amaal Mallik, Arijit Singh, Tulsi Kumar",Romantic,Airlift,9.3/10
Tu Meri,Vishal Dadlani,DanceRomantic,Bang bang,9.5/10
Baby Ko Bass Pasand Hai,"Badshah, Ishita, Shalmali Kholgade, Vishal Dadlani",Dance,Sultan,7.9/10
Daddy Mummy,"Devi Sri Prasad, M. M. Manasi",Dance,Bhaag Johnny,9.0/10
Dekha Hazaro Dafaa,"Arijit Singh, Palak Muchhal",Romantic,Rustom,9.6/10
Khatar Patar,Papon,Dance,Sui Dhaaga,9.4/10
Party With The Bhoothnath,Yo Yo Honey Singh,Dance,Bhoothnath Returns,9.0/10
Hasi,Ami Mishra,RomanticSad,Hamari Adhuri Kahani,9.5/10
Good Man Di Laaltein,"Sukhwinder Singh, Sunidhi Chauhan",Dance,Soorma,9.5/10
Kaabil Hoon,"Jubin Nautiyal, Palak Muchhal",Romantic,Kaabil,8.8/10
Manali Trance,"Neha Kakkar, Yo Yo Honey Singh",Dance,The Shaukeens,9.4/10
Main Teri Dushman Dushman Tu,Lata Mangeshkar,Dance,Nagina,7.3/10
Hafiz Hafiz,Mohit Chauhan,Romantic,Laila Majnu,9.4/10
Daryaa,"Ammy Virk, Shahid Mallya",Sad,Manmarziyaan,9.6/10
Main Adhoora,"Aakanksha Sharma, Yasser Desai",Sad,Beiimaan Love,8.8/10
Aao Raja,"Neha Kakkar, Yo Yo Honey Singh",Dance,Gabbar Is Back,9.1/10
Haseeno Ka Deewana,"Payal Dev, Raftaar",Dance,Kaabil,9.1/10
Swag,"Brijesh Shandaliya, Pranaay",Dance,Munna Michael,9.1/10
Ki Kariye Nachna Aaonda Nahin,"Hardy Sandhu, Neha Kakkar, Raftaar",Dance,Tum Bin 2,9.0/10
Neele Neele Ambar par,Kishore Kumar,Dance,Kalaakaar,9.3/10
Choli Ke Peeche Kya Hai (Female),"Alka Yagnik, Vinod Rathod",Dance,Khal Nayak,8.7/10
Kitna Haseen Chehra,Kumar Sanu,Romantic,Dilwale,8.2/10
Girl I Need You,"Arijit Singh, Roach Killa",Romantic,Baaghi,9.3/10
Sanam Teri Kasam,Ankit Tiwari,Romantic,Sanam Teri Kasam,9.3/10
Kisi Din Banoongi Main,"Alka Yagnik, Udit Narayan",Dance,Raja,8.4/10
Badan Pe Sitaare,Sonu Nigam,DanceRomantic,Fanney Khan,9.3/10
Menu Kehn De,Himesh Reshammiya,Sad,Aap Se Mausiiquii,8.9/10
Bekhudi,"Aditi Singh Sharma, Darshan Raval",Romantic,Teraa Surroor,9.0/10
Kun Faya Kun,"A.R. Rahman, Javed Ali, Mohit Chauhan",Dance,Rockstar,9.4/10
Balam Pichkari,"Shalmali Kholgade, Vishal Dadlani",Dance,Yeh Jawaani Hai Deewani,9.1/10
Tinka Tinka Dil Mera,Rahat Fateh Ali Khan,Sad,Tubelight,9.4/10
Jaana Ve,Arijit Singh,Romantic,Aksar 2,9.3/10
The Disco Song,"Benny Dayal, Nazia Hassan, Sunidhi Chauhan",Dance,Student of the Year,9.1/10
Nagada Sang Dhol,"Osman Mir, Shreya Ghoshal",Dance,Goliyon Ki Rasleela Ram-leela,9.0/10
Tune Mari Entriyaan,"Bappi Lahiri, K.K., Neeti Mohan, Vishal Dadlani",Dance,Gunday,8.9/10
Ijazat,"Arijit Singh, Meet Bros",RomanticSensual,One Night Stand,8.5/10
Tujhse Naaraz Nahi Zindagi,Anup Ghoshal,Sad,Masoom,9.2/10
Pyar Kabhi Kam Nahi Karna,"Asha Bhosle, Bappi Lahiri",Romantic,Prem Pratigyaa,8.2/10
Chikni Chameli,Shreya Ghoshal,Dance,Agneepath,9.2/10
Zaroorat,Mustafa Zahid,Sad,Ek Villain,9.4/10
Bang Bang,"Benny Dayal, Neeti Mohan",Dance,Bang bang,9.3/10
Bulleya,Papon,Romantic,Sultan,9.4/10
Barso Re,Shreya Ghoshal,Dance,Guru,9.3/10
Manwa Laage,"Arijit Singh, Shreya Ghoshal",Romantic,Happy New Year,9.3/10
The Google Song,"Amaal Mallik, Armaan Malik, Neeti Mohan, Sonu Nigam, Tulsi Kumar",Dance,Mubarakan,9.1/10
Ek Mulaqat,Jubin Nautiyal,RomanticSad,Sonali Cable,9.3/10
Aa Toh Sahii,"Meet Bros, Neha Kakkar",Dance,Judwaa 2,9.2/10
Nazm Nazm,Arko,Romantic,Bareilly Ki Barfi,9.6/10
Teri Ore,"Rahat Fateh Ali Khan, Shreya Ghoshal",Romantic,Singh Is Kinng,9.4/10
Toota Jo Kabhi Tara,"Atif Aslam, Sumedha Karmahe",Sad,A Flying Jatt,9.3/10
Say “Shava Shava”,"Aadesh, Alka Yagnik, Amitabh Bachchan, Sudesh Bhosle, Sunidhi Chauhan",Dance,Kabhi Khushi Kabhie Gham,9.1/10
Sunn Raha Hai (Male),Ankit Tiwari,Sad,Aashqui 2,9.3/10
Tu Banja Gali Benaras Ki,Asit Tripathy,Romantic,Shaadi Mein Zaroor Aana,9.6/10
Khuda Bhi,Mohit Chauhan,Romantic,Ek Paheli Leela,9.1/10
Chaar Botal Vodka,Yo Yo Honey Singh,Dance,Ragini MMS 2,8.8/10
Chaar Botal Vodka,Yo Yo Honey Singh,Dance,Ragini MMS 2,8.8/10
Selfie Le Le Re,"Badshah, Nakash Aziz, Pritam, Vishal Dadlani",Dance,Bajrangi Bhaijaan,8.8/10
India Wale,"K.K., Neeti Mohan, Shankar Mahadevan, Vishal Dadlani",Dance,Happy New Year,9.1/10
Kudi Gujarat Di,"Akasa Singh, Jasbir Jassi, Sonia Sharma",Dance,Sweetiee Weds NRI,9.3/10
Lag Ja Gale,Rahat Fateh Ali Khan,Romantic,Bhoomi,9.5/10
O O Jaane Jaana,Kamaal khan,Dance,Pyaar Kiya To Darna Kya,9.3/10
Fevicol Se,"Keerthi Sagathia, Mamta Sharma, Shadab Faridi, Uvie, Wajid",Dance,Dabangg 2,8.8/10
Tishnagi,"Dev Negi, Sunidhi Chauhan",Sensual,Tishnagi,8.8/10
Saiyaara,"Mohit Chauhan, Tarannum Malik",Sad,Ek Tha Tiger,9.2/10
Jab Mehndi Lag Lag Jaave,"Shreya Ghoshal, Sonu Nigam",Dance,Singh Saab The Great,8.7/10
Baarish (Atif Aslam),Atif Aslam,Romantic,Half Girlfriend,9.3/10
Akkad Bakkad,"Badshah, Neha Kakkar",Dance,Sanam Re,9.1/10
Tum Ho Toh Lagta Hai,Shaan,Romantic,Dil Juunglee,9.7/10
Kya Khoob Lagti Ho,,Dance,Dharmatma,8.6/10
Kya Khoob Lagti Ho,"Kanchan, Mukesh",Romantic,Dharmatma,8.6/10
Saturday,"Akriti Kakar, Badshah, Indeep Bakshi",Dance,Humpty Sharma Ki Dulhania,9.1/10
Dard Karaara,"Kumar Sanu, Sadhana Sargam",Romantic,Dum Laga Ke Haisha,8.9/10
Akhiyaan Milaoon Kabhi,"Alka Yagnik, Udit Narayan",Dance,Raja,9.0/10
Mere Humsafar,"Mithoon, Tulsi Kumar",Sad,All is Well,9.2/10
Hangover,"Anjjan, Meet Bros, Salman Khan, Shreya Ghoshal",Romantic,Kick,9.1/10
Mind Blowing,Mika Singh,Dance,Veerey Ki Wedding,9.1/10
Jaaneman Aah,"Aaman Trikha, Antara Mitra",Dance,Dishoom,9.1/10
Dangal,Daler Mehndi,Motivational,Dangal,9.1/10
Jag Ghoomeya (Female),Neha Bhasin,Romantic,Sultan,9.1/10
Madamiyan,"Mamta Sharma, Mika Singh",Dance,Tevar,9.1/10
Hum Nahi Sudhrenge,Armaan Malik,Dance,Golmaal Again,8.8/10
Aye Watan Tere Liye,"Kavita Krishnamurthy, Mohammad Aziz",Patriotic,Karma,8.8/10
Tu Hai,"A.R. Rahman, Sanah Moidutty",Romantic,Mohenjo Daro,9.4/10
Likhne Wale Ne Likh Dale,"Lata Mangeshkar, Suresh Wadkar",Dance,Arpan,7.7/10
Duniya Bananewale,Mukesh,Sad,Teesri Kasam,8.4/10
Bum Bum Bole,Shaan,Dance,Taare Zameen Par,7.4/10
Hans Mat Pagli,"Shreya Ghoshal, Sonu Nigam",Romantic,Toilet Ek Prem Katha,9.3/10
Butterfly,"Aaman Trikha, Dev Negi, Jyoti Nooran, Sultana Nooran, Sunidhi Chauhan",Dance,Jab Harry Met Sejal,9.1/10
Nayak Nahi Khalnayak Hoon Main,"Kavita Krishnamurthy, Vinod Rathod",Dance,Khal Nayak,8.7/10
Saree Ke Fall Sa,"Antara Mitra, Nakash Aziz",Dance,R... Rajkumar,8.9/10
Galla Goriyan – Aaja Soniye,"Kanika Kapoor, Mika Singh",Dance,Baa Baa Black Sheep,9.3/10
Mubarakan Title Song,"Badshah, Juggy D, Sukriti Kakar, Yash Narvekar",Dance,Mubarakan,9.4/10
Nachdi Phira,Meghna Mishra,Sad,Secret Superstar,9.6/10
Maula Mere Maula,Roop Kumar Rathod,Romantic,Anwar,9.4/10
Raah Mein Unse Mulaqat,"Alka Yagnik, Kumar Sanu",Romantic,Vijaypath,8.7/10
Resham Ka Rumaal,"Sonia Sharma, Toshi Sabri",Dance,Great Grand Masti,9.0/10
